{
  "$schema": "https://json-schema.org/draft/2020-12/schema",
  "$id": "https://perkcommons.com/schema/opportunity.json",
  "title": "PerkCommons opportunity",
  "type": "object",
  "additionalProperties": false,
  "required": [
    "id", "provider", "title", "category", "tags", "description",
    "eligibility", "value", "sourceUrl", "officialUrl", "status",
    "submissionType", "sponsor", "reviewDate"
  ],
  "properties": {
    "id": { "type": "string", "pattern": "^[a-z0-9]+(?:-[a-z0-9]+)*$", "minLength": 3, "maxLength": 80 },
    "provider": { "type": "string", "minLength": 2, "maxLength": 100 },
    "title": { "type": "string", "minLength": 3, "maxLength": 140 },
    "category": {
      "enum": ["startup-benefits", "student-benefits", "nonprofit-benefits", "developer-programs", "funding", "accelerators-incubators", "competitions-hackathons", "fellowships", "internships-work-experience", "research-opportunities", "mentorship-community", "education-training", "open-source", "social-impact-civic-tech", "creator-media", "events-conferences", "discounts-perks", "volunteer-service", "awards-recognition", "early-access"]
    },
    "subcategories": {
      "type": "array",
      "items": { "type": "string", "pattern": "^[a-z0-9]+(?:-[a-z0-9]+)*$" },
      "uniqueItems": true,
      "maxItems": 8,
      "default": []
    },
    "tags": { "type": "array", "items": { "type": "string", "pattern": "^[a-z0-9]+(?:-[a-z0-9]+)*$" }, "uniqueItems": true, "maxItems": 12 },
    "description": { "type": "string", "minLength": 20, "maxLength": 2000 },
    "eligibility": { "type": "string", "minLength": 5, "maxLength": 2000 },
    "value": { "type": "string", "minLength": 2, "maxLength": 2000 },
    "sourceUrl": { "type": "string", "format": "uri", "pattern": "^https://" },
    "officialUrl": { "type": "string", "format": "uri", "pattern": "^https://" },
    "status": { "enum": ["active", "limited", "waitlist", "unconfirmed", "expired", "disputed"] },
    "submissionType": { "enum": ["community", "company", "maintainer"] },
    "sponsor": { "type": "boolean" },
    "reviewDate": { "type": "string", "format": "date" },
    "regions": { "type": "array", "items": { "type": "string", "minLength": 2, "maxLength": 120 }, "uniqueItems": true, "default": ["Global"] },
    "notes": { "type": "string", "maxLength": 500 }
  }
}
