{
  "id": "beats-data-analytics-externship",
  "provider": "Beats by Dr. Dre and Extern",
  "title": "Data Analytics Insights Externship",
  "category": "internships-work-experience",
  "subcategories": [
    "externships",
    "project-based-experience"
  ],
  "tags": [
    "externships",
    "remote"
  ],
  "description": "Data Analytics Insights Externship is a remote project-based externship listed by Extern administered by Beats by Dr. Dre and Extern.",
  "eligibility": "Applicants must meet the current career-stage, affiliation, location, availability, work-authorization, and application requirements.",
  "value": "Guided project work, portfolio deliverables, professional exposure, and any listed stipend",
  "sourceUrl": "https://www.extern.com/externships",
  "officialUrl": "https://www.extern.com/externships",
  "status": "unconfirmed",
  "submissionType": "maintainer",
  "sponsor": false,
  "reviewDate": "2026-07-18",
  "regions": [
    "Global"
  ]
}
