{
  "id": "treehacks",
  "provider": "Stanford University",
  "title": "TreeHacks",
  "category": "competitions-hackathons",
  "subcategories": [
    "in-person-hackathons",
    "student-competitions"
  ],
  "tags": [
    "hackathon",
    "students"
  ],
  "description": "TreeHacks is a recurring student hackathon organized by Stanford University, bringing eligible participants together to build projects during an intensive event.",
  "eligibility": "Participants must meet the current age, location, team, entry, conduct, intellectual-property, and deadline requirements.",
  "value": "Team-building event, mentoring, project showcase, and event-specific prizes",
  "sourceUrl": "https://www.treehacks.com/",
  "officialUrl": "https://www.treehacks.com/",
  "status": "unconfirmed",
  "submissionType": "maintainer",
  "sponsor": false,
  "reviewDate": "2026-07-18",
  "regions": [
    "Global"
  ]
}
