{
  "id": "season-of-kde",
  "provider": "KDE Community",
  "title": "Season of KDE",
  "category": "fellowships",
  "subcategories": [
    "technical-fellowships",
    "open-source-fellowships"
  ],
  "tags": [
    "open-source",
    "technology"
  ],
  "description": "Season of KDE is an open-source technical fellowship or mentored contribution program administered by KDE Community.",
  "eligibility": "Applicants must meet the current career-stage, location, experience, affiliation, conduct, and application requirements.",
  "value": "Mentoring, practical open-source experience, and program-specific stipend or support",
  "sourceUrl": "https://season.kde.org/",
  "officialUrl": "https://season.kde.org/",
  "status": "unconfirmed",
  "submissionType": "maintainer",
  "sponsor": false,
  "reviewDate": "2026-07-18",
  "regions": [
    "Global"
  ]
}
