{
  "id": "cal-job-shadow",
  "provider": "University of California, Berkeley",
  "title": "Cal Job Shadow Program",
  "category": "internships-work-experience",
  "subcategories": [
    "externships",
    "job-shadowing-programs"
  ],
  "tags": [
    "job-shadowing",
    "career-exploration"
  ],
  "description": "Cal Job Shadow Program is a short-term job-shadow or externship program administered by University of California, Berkeley.",
  "eligibility": "Applicants must meet the current career-stage, affiliation, location, availability, work-authorization, and application requirements.",
  "value": "Workplace observation, career exploration, and professional networking",
  "sourceUrl": "https://www.career.berkeley.edu/find-opportunities/experiential-learning/externship-program/",
  "officialUrl": "https://www.career.berkeley.edu/find-opportunities/experiential-learning/externship-program/",
  "status": "unconfirmed",
  "submissionType": "maintainer",
  "sponsor": false,
  "reviewDate": "2026-07-18",
  "regions": [
    "Global"
  ]
}
