{
  "id": "outreachy-internships",
  "provider": "Software Freedom Conservancy",
  "title": "Outreachy Internships",
  "category": "fellowships",
  "subcategories": [
    "technical-fellowships",
    "open-source-fellowships"
  ],
  "tags": [
    "open-source",
    "technology"
  ],
  "description": "Outreachy Internships is an open-source technical fellowship or mentored contribution program administered by Software Freedom Conservancy.",
  "eligibility": "Applicants must meet the current career-stage, location, experience, affiliation, conduct, and application requirements.",
  "value": "Mentoring, practical open-source experience, and program-specific stipend or support",
  "sourceUrl": "https://www.outreachy.org/",
  "officialUrl": "https://www.outreachy.org/",
  "status": "unconfirmed",
  "submissionType": "maintainer",
  "sponsor": false,
  "reviewDate": "2026-07-18",
  "regions": [
    "Global"
  ]
}
