{
  "id": "statistics-without-borders",
  "provider": "Statistics Without Borders",
  "title": "Volunteer Projects",
  "category": "volunteer-service",
  "subcategories": [
    "skilled-volunteering",
    "nonprofit-projects",
    "pro-bono-work",
    "remote-volunteering"
  ],
  "tags": [
    "skills-based-volunteering",
    "nonprofits"
  ],
  "description": "Volunteer Projects is a skills-based volunteering platform or program that matches professionals with nonprofit projects administered by Statistics Without Borders.",
  "eligibility": "Volunteers must meet the current age, location, skills, availability, screening, and program-specific requirements.",
  "value": "Remote or flexible pro bono projects that apply professional skills to nonprofit needs",
  "sourceUrl": "https://www.statisticswithoutborders.org/",
  "officialUrl": "https://www.statisticswithoutborders.org/",
  "status": "unconfirmed",
  "submissionType": "maintainer",
  "sponsor": false,
  "reviewDate": "2026-07-18",
  "regions": [
    "Global"
  ]
}
