{
  "id": "cshl-undergraduate-research",
  "provider": "Cold Spring Harbor Laboratory",
  "title": "Undergraduate Research Program",
  "category": "research-opportunities",
  "subcategories": [
    "research-internships",
    "research-assistantships",
    "lab-programs"
  ],
  "tags": [
    "research",
    "internships"
  ],
  "description": "Undergraduate Research Program is a supervised research internship with project work in an academic or scientific environment administered by Cold Spring Harbor Laboratory.",
  "eligibility": "Researchers must meet the current program, affiliation, location, subject-area, and application requirements.",
  "value": "Research experience, supervision, and program-specific funding or support",
  "sourceUrl": "https://www.cshl.edu/education/undergraduate-research-program/",
  "officialUrl": "https://www.cshl.edu/education/undergraduate-research-program/",
  "status": "unconfirmed",
  "submissionType": "maintainer",
  "sponsor": false,
  "reviewDate": "2026-07-18",
  "regions": [
    "Global"
  ]
}
