{
  "id": "ashoka-fellowship",
  "provider": "Ashoka",
  "title": "Ashoka Fellowship",
  "category": "fellowships",
  "subcategories": [
    "entrepreneurship-fellowships"
  ],
  "tags": [
    "entrepreneurship",
    "founders"
  ],
  "description": "Ashoka Fellowship is an entrepreneurship fellowship administered by Ashoka.",
  "eligibility": "Applicants must meet the current career-stage, location, experience, affiliation, conduct, and application requirements.",
  "value": "Founder development, mentoring, peer network, and program-specific funding or support",
  "sourceUrl": "https://www.ashoka.org/en-us/program/ashoka-fellowship",
  "officialUrl": "https://www.ashoka.org/en-us/program/ashoka-fellowship",
  "status": "unconfirmed",
  "submissionType": "maintainer",
  "sponsor": false,
  "reviewDate": "2026-07-18",
  "regions": [
    "Global"
  ]
}
