{
  "id": "prototype-fund",
  "provider": "Prototype Fund",
  "title": "Prototype Fund",
  "category": "developer-programs",
  "subcategories": [
    "open-source-programs",
    "maintainer-support",
    "developer-grants"
  ],
  "tags": [
    "developers",
    "open-source"
  ],
  "description": "Prototype Fund funds or supports selected open-source developers, maintainers, and public-interest technology projects.",
  "eligibility": "Applicants or participants must satisfy the provider's current technical, account, conduct, scope, selection, and regional requirements.",
  "value": "Grant funding or structured maintainer support subject to selection",
  "sourceUrl": "https://prototypefund.de/en/",
  "officialUrl": "https://prototypefund.de/en/",
  "status": "unconfirmed",
  "submissionType": "maintainer",
  "sponsor": false,
  "reviewDate": "2026-07-18",
  "regions": [
    "Global"
  ]
}
