{
  "id": "hackyourfuture-program",
  "provider": "HackYourFuture",
  "title": "Web Development Program",
  "category": "education-training",
  "subcategories": [
    "bootcamps",
    "scholarships",
    "tuition-support"
  ],
  "tags": [
    "bootcamp",
    "tuition-free"
  ],
  "description": "Web Development Program is a tuition-free or fully supported intensive training program administered by HackYourFuture.",
  "eligibility": "Learners must meet the current age, location, affiliation, experience, and program-specific requirements.",
  "value": "Structured instruction, projects, community support, and no-cost or scholarship-backed tuition",
  "sourceUrl": "https://www.hackyourfuture.net/",
  "officialUrl": "https://www.hackyourfuture.net/",
  "status": "unconfirmed",
  "submissionType": "maintainer",
  "sponsor": false,
  "reviewDate": "2026-07-18",
  "regions": [
    "Global"
  ]
}
