{
  "id": "aws-heroes",
  "provider": "Amazon Web Services",
  "title": "AWS Heroes",
  "category": "developer-programs",
  "subcategories": [
    "ambassador-programs"
  ],
  "tags": [
    "developers",
    "ambassador"
  ],
  "description": "AWS Heroes recognizes experienced technical community contributors and provides resources for advocacy, education, and peer support.",
  "eligibility": "Applicants or participants must satisfy the provider's current technical, account, conduct, scope, selection, and regional requirements.",
  "value": "Community recognition, program resources, and contributor opportunities",
  "sourceUrl": "https://aws.amazon.com/developer/community/heroes/",
  "officialUrl": "https://aws.amazon.com/developer/community/heroes/",
  "status": "unconfirmed",
  "submissionType": "maintainer",
  "sponsor": false,
  "reviewDate": "2026-07-18",
  "regions": [
    "Global"
  ]
}
