{
  "id": "nasa-solve",
  "provider": "NASA",
  "title": "NASA Solve Challenges",
  "category": "research-opportunities",
  "subcategories": [
    "academic-challenges"
  ],
  "tags": [
    "research",
    "challenges"
  ],
  "description": "NASA Solve Challenges is an official challenge platform or recurring program where researchers can test methods against defined problems administered by NASA.",
  "eligibility": "Researchers must meet the current program, affiliation, location, subject-area, and application requirements.",
  "value": "Benchmark data, evaluation, collaboration, and challenge-specific recognition or awards",
  "sourceUrl": "https://www.nasa.gov/solve/",
  "officialUrl": "https://www.nasa.gov/solve/",
  "status": "unconfirmed",
  "submissionType": "maintainer",
  "sponsor": false,
  "reviewDate": "2026-07-18",
  "regions": [
    "Global"
  ]
}
