{
  "id": "bread-loaf-writers-conference",
  "provider": "Middlebury College",
  "title": "Bread Loaf Writers’ Conference",
  "category": "creator-media",
  "subcategories": [
    "writing-programs",
    "publishing-support"
  ],
  "tags": [
    "writers",
    "publishing"
  ],
  "description": "Bread Loaf Writers’ Conference is a selective writing-development program offering eligible writers workshops, mentorship, residency time, or routes toward publication administered by Middlebury College.",
  "eligibility": "Applicants must meet the current discipline, career stage, geography, project ownership, application window, and program-specific requirements.",
  "value": "Craft development, editorial feedback, literary community access, and program-specific scholarships or publishing connections",
  "sourceUrl": "https://www.middlebury.edu/writers-conferences/writers-conference",
  "officialUrl": "https://www.middlebury.edu/writers-conferences/writers-conference",
  "status": "unconfirmed",
  "submissionType": "maintainer",
  "sponsor": false,
  "reviewDate": "2026-07-18",
  "regions": [
    "Global"
  ]
}
