{
  "id": "linux-foundation-project-hosting",
  "provider": "Linux Foundation",
  "title": "Project Hosting",
  "category": "open-source",
  "subcategories": [
    "sponsorships",
    "fiscal-hosting",
    "project-grants"
  ],
  "tags": [
    "fiscal-hosting",
    "project-support"
  ],
  "description": "Project Hosting is an open-source project home or fiscal-hosting pathway that provides organizational, financial, or administrative support administered by Linux Foundation.",
  "eligibility": "Projects or contributors must meet the current open-source license, governance, activity, location, and program-specific requirements.",
  "value": "Fiscal stewardship, legal or administrative support, fundraising infrastructure, and project governance services",
  "sourceUrl": "https://www.linuxfoundation.org/projects/hosting",
  "officialUrl": "https://www.linuxfoundation.org/projects/hosting",
  "status": "unconfirmed",
  "submissionType": "maintainer",
  "sponsor": false,
  "reviewDate": "2026-07-18",
  "regions": [
    "Global"
  ]
}
